{
  "schema": "lab.collision_candidate_report/v1",
  "status": "candidate-generated",
  "qualification": "offline-collision-candidate",
  "asset_id": "ptlc.develop-tank-rack",
  "request_sha256": "c2dc1bc79891bb8b37ca2f216b9c955a6fc8a0db7040f2503137a844485d7017",
  "generator": {
    "name": "unilab-generic-collision-candidate-generator",
    "version": "v3",
    "script_ref": "scripts/generate_collision_candidates.py",
    "script_sha256": "7fa123e05ab2dc928044d191761a0e1a1c1f7fce447524de3f49ce3f9ddfcb67",
    "numpy_version": "2.5.1",
    "trimesh_version": "4.12.2"
  },
  "source": {
    "kind": "glb",
    "source_ref": "../related/unilabSZlab/pTLC仿真资产/proxies/develop_tank_rack/visual.glb",
    "source_sha256": "773ef4fcdb3126fe51e785404386da0acf4b509024d7f567b317b9c7227b9c01",
    "geometry_ref": "../related/unilabSZlab/pTLC仿真资产/proxies/develop_tank_rack/visual.glb",
    "geometry_sha256": "773ef4fcdb3126fe51e785404386da0acf4b509024d7f567b317b9c7227b9c01",
    "geometry_unit": "m",
    "direct_brep_parsed": false,
    "geometry_basis": "source-glb"
  },
  "policy": {
    "l2_mode": "compound-convex",
    "max_components": 128,
    "max_sample_vertices": 10000,
    "cavity_added_fill_ratio_limit": 0.05
  },
  "source_geometry": {
    "vertices": 320,
    "triangles": 480,
    "component_count": 40,
    "bounds": {
      "min_m": [
        -0.5249999761581421,
        -0.3100000023841858,
        0.0
      ],
      "max_m": [
        0.5249999761581421,
        0.3100000023841858,
        0.9800000190734863
      ],
      "size_m": [
        1.0499999523162842,
        0.6200000047683716,
        0.9800000190734863
      ]
    },
    "watertight": {
      "is_watertight": true,
      "is_winding_consistent": true,
      "is_volume": true,
      "euler_number": 80,
      "boundary_edge_count": 0,
      "nonmanifold_edge_count": 0
    },
    "volume_m3": 0.1431695256770563
  },
  "levels": {
    "l0": {
      "aabb": {
        "method": "axis-aligned-bounding-box",
        "path": "l0/aabb.glb",
        "sha256": "e48408a638a948ae4da4a451a3e06a03faddbc70ac6a82d4910839385e91ce1b",
        "geometry": {
          "vertices": 8,
          "triangles": 12,
          "component_count": 1,
          "bounds": {
            "min_m": [
              -0.5249999761581421,
              -0.3100000023841858,
              0.0
            ],
            "max_m": [
              0.5249999761581421,
              0.3100000023841858,
              0.9800000190734863
            ],
            "size_m": [
              1.0499999523162842,
              0.6200000047683716,
              0.9800000190734863
            ]
          },
          "watertight": {
            "is_watertight": true,
            "is_winding_consistent": true,
            "is_volume": true,
            "euler_number": 2,
            "boundary_edge_count": 0,
            "nonmanifold_edge_count": 0
          },
          "volume_m3": 0.6379799883508676
        },
        "size_error": {
          "aabb_source_size_m": [
            1.0499999523162842,
            0.6200000047683716,
            0.9800000190734863
          ],
          "aabb_candidate_size_m": [
            1.0499999523162842,
            0.6200000047683716,
            0.9800000190734863
          ],
          "aabb_absolute_error_m": [
            0.0,
            0.0,
            0.0
          ],
          "aabb_max_relative_error": 0.0,
          "obb_source_extents_sorted_m": [
            0.6200000047683716,
            0.9800000190734863,
            1.0499999523162842
          ],
          "obb_candidate_extents_sorted_m": [
            0.6200000047683716,
            0.9800000190734863,
            1.0499999523162842
          ],
          "obb_absolute_error_sorted_m": [
            0.0,
            0.0,
            0.0
          ]
        },
        "missed_envelope": {
          "metric": "sampled-convex-halfspace-outward-violation",
          "sample_count": 320,
          "maximum_missed_envelope_m": 0.0,
          "passes_at_1e-8_m": true,
          "scope": "source vertices; not continuous CAD surface"
        },
        "cavity_preservation": {
          "metric": "added-solid-volume-fraction-of-source-aabb",
          "limit": 0.05,
          "source_aabb_volume_m3": 0.6379799883508676,
          "source_component_count": 40,
          "candidate_component_count": 1,
          "component_separation_preserved": false,
          "status": "not-preserved",
          "cavity_preserved": false,
          "reason": "candidate fills too much source-envelope empty space",
          "source_volume_m3": 0.1431695256770563,
          "candidate_volume_m3": 0.6379799883508676,
          "added_solid_volume_m3": 0.49481046267381124,
          "added_fill_ratio": 0.7755893158229943
        },
        "fallbacks": []
      },
      "obb": {
        "method": "oriented-bounding-box",
        "path": "l0/obb.glb",
        "sha256": "a73b34268da076af82ef5c77bfc4e38028423aa2cd8e38b0faf2cf1de772c1a6",
        "geometry": {
          "vertices": 8,
          "triangles": 12,
          "component_count": 1,
          "bounds": {
            "min_m": [
              -0.5249999761581421,
              -0.31000000238418585,
              0.0
            ],
            "max_m": [
              0.5249999761581421,
              0.31000000238418585,
              0.9800000190734863
            ],
            "size_m": [
              1.0499999523162842,
              0.6200000047683717,
              0.9800000190734863
            ]
          },
          "watertight": {
            "is_watertight": true,
            "is_winding_consistent": true,
            "is_volume": true,
            "euler_number": 2,
            "boundary_edge_count": 0,
            "nonmanifold_edge_count": 0
          },
          "volume_m3": 0.6379799883508676
        },
        "size_error": {
          "aabb_source_size_m": [
            1.0499999523162842,
            0.6200000047683716,
            0.9800000190734863
          ],
          "aabb_candidate_size_m": [
            1.0499999523162842,
            0.6200000047683717,
            0.9800000190734863
          ],
          "aabb_absolute_error_m": [
            0.0,
            1.1102230246251565e-16,
            0.0
          ],
          "aabb_max_relative_error": 1.790682284010513e-16,
          "obb_source_extents_sorted_m": [
            0.6200000047683716,
            0.9800000190734863,
            1.0499999523162842
          ],
          "obb_candidate_extents_sorted_m": [
            0.6200000047683716,
            0.9800000190734863,
            1.0499999523162842
          ],
          "obb_absolute_error_sorted_m": [
            0.0,
            0.0,
            0.0
          ]
        },
        "missed_envelope": {
          "metric": "sampled-convex-halfspace-outward-violation",
          "sample_count": 320,
          "maximum_missed_envelope_m": 5.551115123125783e-17,
          "passes_at_1e-8_m": true,
          "scope": "source vertices; not continuous CAD surface"
        },
        "cavity_preservation": {
          "metric": "added-solid-volume-fraction-of-source-aabb",
          "limit": 0.05,
          "source_aabb_volume_m3": 0.6379799883508676,
          "source_component_count": 40,
          "candidate_component_count": 1,
          "component_separation_preserved": false,
          "status": "not-preserved",
          "cavity_preserved": false,
          "reason": "candidate fills too much source-envelope empty space",
          "source_volume_m3": 0.1431695256770563,
          "candidate_volume_m3": 0.6379799883508676,
          "added_solid_volume_m3": 0.49481046267381124,
          "added_fill_ratio": 0.7755893158229943
        },
        "fallbacks": []
      }
    },
    "l1": {
      "best_primitive": {
        "method": "minimum-volume-bounding-box",
        "path": "l1/best-primitive.glb",
        "sha256": "c6fbddc7cd1d7a890a3e6a5f32a55dfa43938a0319cc1edbe16e92cc02cd483d",
        "geometry": {
          "vertices": 8,
          "triangles": 12,
          "component_count": 1,
          "bounds": {
            "min_m": [
              -0.5249999761581421,
              -0.31000000238418585,
              0.0
            ],
            "max_m": [
              0.5249999761581421,
              0.31000000238418585,
              0.9800000190734863
            ],
            "size_m": [
              1.0499999523162842,
              0.6200000047683717,
              0.9800000190734863
            ]
          },
          "watertight": {
            "is_watertight": true,
            "is_winding_consistent": true,
            "is_volume": true,
            "euler_number": 2,
            "boundary_edge_count": 0,
            "nonmanifold_edge_count": 0
          },
          "volume_m3": 0.6379799883508676
        },
        "size_error": {
          "aabb_source_size_m": [
            1.0499999523162842,
            0.6200000047683716,
            0.9800000190734863
          ],
          "aabb_candidate_size_m": [
            1.0499999523162842,
            0.6200000047683717,
            0.9800000190734863
          ],
          "aabb_absolute_error_m": [
            0.0,
            1.1102230246251565e-16,
            0.0
          ],
          "aabb_max_relative_error": 1.790682284010513e-16,
          "obb_source_extents_sorted_m": [
            0.6200000047683716,
            0.9800000190734863,
            1.0499999523162842
          ],
          "obb_candidate_extents_sorted_m": [
            0.6200000047683716,
            0.9800000190734863,
            1.0499999523162842
          ],
          "obb_absolute_error_sorted_m": [
            0.0,
            0.0,
            0.0
          ]
        },
        "missed_envelope": {
          "metric": "sampled-convex-halfspace-outward-violation",
          "sample_count": 320,
          "maximum_missed_envelope_m": 5.551115123125783e-17,